{
  "$id": "https://github.com/thrace-app/addresses/schema/account.schema.json",
  "$schema": "https://json-schema.org/draft/2020-12/schema",
  "title": "Account",
  "type": "object",
  "properties": {
    "address": {
      "type": "string"
    },
    "displayName": {
      "type": "string"
    },
    "group": {
      "type": "string"
    },
    "type": {
      "type": "string",
      "enum": [
        "WALLET",
        "TOKEN",
        "EXCHANGE",
        "SWAP",
        "BRIDGE",
        "MARKETPLACE",
        "LIQUIDITY_PROVIDER",
        "MIXER",
        "OTHER"
      ]
    },
    "token": {
      "$ref": "./token.schema.json"
    }
  },
  "required": ["address", "displayName", "type"],
  "anyOf": [
    {
      "properties": {
        "type": { "const": "TOKEN" }
      },
      "required": ["token"]
    }
  ]
}
