{
  "$schema": "../../../../schema/account.schema.json",
  "address": "0x2bfa4843f5945b59f072238cafae2d0737131118",
  "displayName": "Baby Lonely Alien Space Club",
  "type": "TOKEN",
  "token": {
    "name": "Baby Lonely Alien Space Club",
    "symbol": "BLASC",
    "decimals": 18,
    "type": "ERC20"
  }
}