{
  "$schema": "../../../../schema/account.schema.json",
  "address": "0x66a60d14c73dccd1626a909559a83525612700bc",
  "displayName": "Beneficent Governance Token",
  "type": "TOKEN",
  "token": {
    "name": "Beneficent Governance Token",
    "symbol": "BGT",
    "decimals": 18,
    "type": "ERC20"
  }
}