{
  "$schema": "../../../../schema/account.schema.json",
  "address": "0x81af96818a8aeaca466a898ebf7dfe5741da95c0",
  "displayName": "Domino Harvey Bounty Hunter",
  "type": "TOKEN",
  "token": {
    "name": "Domino Harvey Bounty Hunter",
    "symbol": "DHBH",
    "decimals": 9,
    "type": "ERC20"
  }
}