{
  "$schema": "../../../../schema/account.schema.json",
  "address": "0xea5edef1c6ed1be1bcba4617a1c5a994e9018a43",
  "displayName": "cvxsteCRV Ease Vault",
  "type": "TOKEN",
  "token": {
    "name": "cvxsteCRV Ease Vault",
    "symbol": "ez-cvxsteCRV",
    "decimals": 18,
    "type": "ERC20"
  }
}