{
  "$schema": "../../../../schema/account.schema.json",
  "address": "0x2d0db905bc6e587e6f37260b946d32d302028901",
  "displayName": "MillionTech | t.me/MillionTech",
  "type": "TOKEN",
  "token": {
    "name": "MillionTech | t.me/MillionTech",
    "symbol": "MT",
    "decimals": 18,
    "type": "ERC20"
  }
}